{
  "$schema": "https://json-schema.org/draft/2020-12/schema",
  "type": "array",
  "items": {
    "type": "object",
    "additionalProperties": false,
    "required": ["source", "post_id", "member_id", "published_at", "processed_at", "type", "status", "source_url", "media"],
    "properties": {
      "source": {"type": "string", "const": "x"},
      "post_id": {"type": "string", "minLength": 1},
      "member_id": {"type": "string", "minLength": 1},
      "published_at": {"type": "string", "format": "date-time"},
      "processed_at": {"type": "string", "format": "date-time"},
      "type": {"type": "string", "enum": ["weekly_schedule", "schedule_change", "sudden_stream", "cancellation", "postponement", "irrelevant", "unknown"]},
      "status": {"type": "string", "enum": ["processed", "pending_review", "ignored", "failed", "manual_review"]},
      "source_url": {"type": "string", "format": "uri"},
      "media": {
        "type": "array",
        "items": {
          "type": "object",
          "additionalProperties": false,
          "required": ["type", "url"],
          "properties": {
            "type": {"type": "string", "const": "image"},
            "url": {"type": "string", "format": "uri"}
          }
        }
      }
    }
  }
}
