[
  {
    "source": "x",
    "post_id": "2109291418233827667",
    "member_id": "miri_aetris",
    "published_at": "2026-10-11T22:33:00+08:00",
    "source_url": "https://x.com/Miri_Aetris/status/2109291418233827667",
    "media": [
      {
        "type": "image",
        "url": "https://pbs.twimg.com/media/HUW1Rbra8AAG0Fz?format=webp&name=large"
      }
    ],
    "processed_at": "2026-10-16T08:37:43+00:00",
    "type": "weekly_schedule",
    "status": "processed"
  },
  {
    "source": "x",
    "post_id": "csv-d212b098a04cd79f5678b23eba8f2fdeb64d15c088b9706265efe359a1919504",
    "member_id": "miri_aetris",
    "source_url": "https://x.com/Miri_Aetris/status/2114373977024188616",
    "published_at": "2026-10-28T04:01:00+08:00",
    "processed_at": "2026-10-28T08:47:55+00:00",
    "type": "weekly_schedule",
    "status": "processed",
    "media": []
  }
]
